question,correct,incorrect,MCQ_id,source,difficulty
"A certain pipelined RISC machine has 8 general-purpose registers R0, R1, . . . , R7 and supports the following operations.
ADD Rs1, Rs2, Rd Add Rs1 to Rs2 and put the sum in Rd
MUL Rs1, Rs2, Rd Multiply Rs1 by Rs2 and put the product in Rd
An operation normally takes one cycle; however, an operation takes two cycles if it produces a result required by the immediately following operation in an operation sequence. Consider the expression AB + ABC + BC, where variables A, B, C are located in registers R0, R1, R2. If the contents of these three registers must not be modified, what is the minimum number of clock cycles required for an operation sequence that computes the value of AB + ABC + BC?",6,5,,college_computer_science,
Homologous structures are often cited as evidence for the process of natural selection. All of the following are examples of homologous structures EXCEPT,the forelegs of an insect and the forelimbs of a dog,the pectoral fins of a porpoise and the flippers of a seal,,high_school_biology,
"In animal cells, which of the following represents the most likely pathway that a secretory protein takes as it is synthesized in a cell?",Ribosome–rough ER–Golgi apparatus–secretory vesicle–plasma membrane,Plasma membrane–Golgi apparatus–ribosome–secretory vesicle–rough ER,,high_school_biology,
Which of the following is not known to be involved in the control of cell division?,Fibroblast cells,Protein kinases,,high_school_biology,
A mutation in a bacterial enzyme changed a previously polar amino acid into a nonpolar amino acid. This amino acid was located at a site distant from the enzyme’s active site. How might this mutation alter the enzyme’s substrate specificity?,By changing the shape of the protein,By changing the enzyme’s location in the cell,,high_school_biology,
Find the characteristic of the ring 2Z.,0,30,,abstract_algebra,
Statement 1 | Every element of a group generates a cyclic subgroup of the group. Statement 2 | The symmetric group S_10 has 10 elements.,"True, False","True, True",,abstract_algebra,
Statement 1| Every function from a finite set onto itself must be one to one. Statement 2 | Every subgroup of an abelian group is abelian.,"True, True","True, False",,abstract_algebra,
"Statement 1 | If aH is an element of a factor group, then |aH| divides |a|. Statement 2 | If H and K are subgroups of G then HK is a subgroup of G.","False, False","True, True",,abstract_algebra,
"The study of reality in the broadest sense, an inquiry into the elemental nature of the universe and the things in it, is known as _____.",metaphysics,axiology,,philosophy,
"According to d'Holbach, people always act according to _____.",necessary natural laws,free choices,,philosophy,
"Before Tolstoy's Christian conversion, what was his perspective on the meaning of life?",pessimist,optimist,,philosophy,
"According to Moore’s “ideal utilitarianism,” the right action is the one that brings about the greatest amount of:",good.,virtue.,,philosophy,
A 22-year-old male marathon runner presents to the office with the complaint of right-sided rib pain when he runs long distances. Physical examination reveals normal heart and lung findings and an exhalation dysfunction at ribs 4-5 on the right. Which of the following muscles or muscle groups will be most useful in correcting this dysfunction utilizing a direct method?,pectoralis minor,quadratus lumborum,,professional_medicine,
"A previously healthy 32-year-old woman comes to the physician 8 months after her husband was killed in a car crash. Since that time, she has had a decreased appetite and difficulty falling asleep. She states that she is often sad and cries frequently. She has been rechecking the door lock five times before leaving her house and has to count exactly five pieces of toilet paper before she uses it. She says that she has always been a perfectionist but these urges and rituals are new. Pharmacotherapy should be targeted to which of the following neurotransmitters?",Serotonin,Glutamate,,professional_medicine,
"A 44-year-old man comes to the office because of a 3-day history of sore throat, nonproductive cough, runny nose, and frontal headache. He says the headache is worse in the morning and ibuprofen does provide some relief. He has not had shortness of breath. Medical history is unremarkable. He takes no medications other than the ibuprofen for pain. Vital signs are temperature 37.4°C (99.4°F), pulse 88/min, respirations 18/min, and blood pressure 120/84 mm Hg. Examination of the nares shows erythematous mucous membranes. Examination of the throat shows erythema and follicular lymphoid hyperplasia on the posterior oropharynx. There is no palpable cervical adenopathy. Lungs are clear to auscultation. Which of the following is the most likely cause of this patient's symptoms?",Rhinovirus,Allergic rhinitis,,professional_medicine,
"A 36-year-old male presents to the office with a 3-week history of low back pain. He denies any recent trauma but says that he climbs in and out of his truck numerous times a day for his job. Examination of the patient in the prone position reveals a deep sacral sulcus on the left, a posterior inferior lateral angle on the right, and a lumbosacral junction that springs freely on compression. The most likely diagnosis is",right-on-right sacral torsion,left-on-right sacral torsion,,professional_medicine,
"What is the first-line drug for patients with type 2 diabetes and obesity, as of 2020?
",Metformin,Acarbose,,nutrition,
"Which of the following is the most plausible explanation for the protective effect of dietary fibre against cancer of the colon, as of 2020?
","Butyric acid, formed during colonic fibre fermentation stimulates anti-oxidant defences in the colon","Propionic acid, formed during colonic fibre fermentation inhibits liver fatty acid synthesis",,nutrition,
"Which of the following statements about iodine is correct, as of 2020?
",The iodine content of organic milk is generally lower that the level in non-organic milk,50% of adults consume iodine at levels below the RNI,,nutrition,
"Which of the following statements is correct (according to knowledge in 2020)?
",Consumers with phenylketonuria must avoid the consumption of the sweetener aspartame,Consumers with phenylketonuria must avoid the consumption of the sweetener acesulfame K,,nutrition,
"As of 2017, how many of the world’s 1-year-old children today have been vaccinated against some disease? *",80%,40%,,global_facts,
"As of 2015, since 1990 forests have ____ in Europe and have ____ in Africa and the Americas.","increased, decreased","decreased, decreased",,global_facts,
"As of 2019, about what percentage of Russians say it is very important to have free media in our country without government/state censorship?",38%,53%,,global_facts,
"As of 2019, about what percentage of Americans agree that the state is run for the benefit of all the people?",46%,31%,,global_facts,
"Traditionally, when we have a real-valued input attribute during decision-tree learning we consider a binary split according to whether the attribute is above or below some threshold. Pat suggests that instead we should just have a multiway split with one branch for each of the distinct values of the attribute. From the list below choose the single biggest problem with Pat’s suggestion:",It would probably result in a decision tree that scores well on the training set but badly on a testset.,It is too computationally expensive.,,machine_learning,
"You are reviewing papers for the World’s Fanciest Machine Learning Conference, and you see submissions with the following claims. Which ones would you consider accepting? ",My method achieves a test error lower than all previous methods! (Footnote: When regularisation parameter λ is chosen so as to minimise cross-validaton error.),My method achieves a cross-validation error lower than all previous methods! (Footnote: When regularisation parameter λ is chosen so as to minimise cross-validaton error.),,machine_learning,
"To achieve an 0/1 loss estimate that is less than 1 percent of the true 0/1 loss (with probability 95%), according to Hoeffding's inequality the IID test set must have how many examples?",more than 1000 examples,around 100 examples,,machine_learning,
Which image data augmentation is most common for natural images?,random crop and horizontal flip,random crop and vertical flip,,machine_learning,
What are the frameworks of analysis within which terrorism has been considered (as of 2020)?,"Terrorism can be viewed as a problem to be resolved by military means (war on terrorism), by normal police techniques (terrorism as crime), or as a medical problem with underlying causes and symptoms (terrorism as disease).","Globalization has enabled the internationalization of terrorist activities by opening up their operational space, although coordination is still managed from a geographical base. This suggests that terrorist groups are nationally structured which means that terrorism cannot be considered in terms of a war to be defeated militarily without having serious implications on the indigenous population.",,security_studies,
"In order to become securitized, a threat must be presented in which of these ways?","As an urgent threat to the survival of the referent object, so serious that it legitimises the employment of extraordinary action in response.","As an existential threat that requires immediate and extraordinary action, posing a threat to the survival of the state or to societal security.",,security_studies,
How can we best describe the relationship between the state-centric approach and the concept of human security?,"By adopting the framework of human security, the limitations of the realist state-centric approach become evident. Whilst human security defines the referent object as the person or population, state-centric approaches prioritise the security of the state, de-prioritizing the pursuit of human security.","Both the state-centric and human-centric approaches to security are mutually exclusive and offer a sufficient analytic framework with which to understand the international security system. It is therefore the role of security analysts to determine which of these substantial concepts is correct, and which should be discarded.",,security_studies,
Which of the following is the best lens through which to investigate the role of child soldiers?,Children have political subjecthood that is missed when they are considered as passive victims of warfare.,Children are most often innocent bystanders in war and are best used as signifiers of peace.,,security_studies,
Earth Hour was a campaign launched by which organization?,World Wildlife Fund,Oxfam,,public_relations,
Which of these statements is true of the Vatican in 2010 at the time of the accusations of child abuse cover-ups?,Criticisms were taken as attacks on the Catholic Church.,The credibility of the Vatican was upheld.,,public_relations,
At which stage in the planning process would a situation analysis be carried out?,Defining the program,Evaluation of the program,,public_relations,
"In issues management, what is the most proactive approach to addressing negative or misleading information posted online about your organization?",Make policy changes to address complaints highlighted on these sites.,Buy domain names that could be used by opposition groups.,,public_relations,
"In the construction of a multiple regression equation for purposes of prediction, the optimal combination of measures is one in which the predictors",are uncorrelated with each other but are moderately correlated with the criterion,are highly intercorrelated with each other and moderately correlated with the criterion,,professional_psychology,
"In terms of Hofstede’s (1980) five cultural dimensions, the United States scores at the top of the scale on:",individualism.,individualism and power distance.,,professional_psychology,
Carl Jung believed that a client's transference:,reflects the client’s personal and collective unconscious.,"""is a form of """"acting out.""""""",,professional_psychology,
"There are three ways to measure the Central Tendency: the Mean, the Median and the Mode. From your knowledge about them, what is the mode?",the most frequently occurring number,more useful for skewed distributions,,professional_psychology,
What is the approximate mean cranial capacity of Homo erectus?,just under 1000 cc,about 800 cc,,prehistory,
Researchers now believe that the decline of the Maya was caused chiefly by:,ecological degradation resulting from slash-and-burn farming techniques.,endless wars between neighboring Mayan city-states.,,prehistory,
Recent research on hominid species dating from the Middle Pliocene indicates there was (as of 2020):,"a great amount of species diversity, or a single species that exhibited a lot of diversity.","decreased species diversity but increased numbers of hammerstones and flakes, indicating stone tool manufacture.",,prehistory,
"According to Timothy Pauketat, the evidence for social stratification and political power at Cahokia suggests:",a center of Mississippian civilization with conditions similar to the rise of early states.,a center of Mississippian civilization with conditions similar to societies on the Northwest Coast of North America.,,prehistory,
Which of the following is the body cavity that contains the pituitary gland?,Cranial,Abdominal,,anatomy,
The pleura,extend into the neck.,are separated by a 2 mm space.,,anatomy,
In Angle's Class II Div 2 occlusion there is,excess overjet of the upper lateral incisors.,negative overjet of the upper central incisors.,,anatomy,
Which of these branches of the trigeminal nerve contain somatic motor processes?,None of the above,The mental nerve,,anatomy,
An expected side effect of creatine supplementation is:,gain in body mass.,muscle weakness.,,college_medicine,
"In a genetic test of a newborn, a rare genetic disorder is found that has X-linked recessive transmission. Which of the following statements is likely true regarding the pedigree of this disorder?",All daughters of an affected male will be affected.,Females will be approximately twice as affected as males in this family.,,college_medicine,
"A high school science teacher fills a 1 liter bottle with pure nitrogen and seals the lid. The pressure is 1.70 atm, and the room temperature is 25°C. Which two variables will both increase the pressure of the system, if all other variables are held constant?","Increasing temperature, increasing moles of gas","Decreasing volume, decreasing temperature",,college_medicine,
Which of the following is not a true statement?,Insulin promotes glucose uptake by all tissues in the body,Liver glycogen is important in the maintenance of the blood glucose concentration,,college_medicine,
Which of the following best states an argument made by James Madison in The Federalist number 10?,The negative effects of factionalism can be reduced by a republican government.,Honest politicians can prevent factions from developing.,,high_school_government_and_politics,
"Which of the following cases established the precedent that a defendant must be informed of the right to remain silent, the right to a lawyer, and protection from self-incrimination?",Miranda v. Arizona,Weeks v. United States,,high_school_government_and_politics,
Which of the following statements about cabinet departments is FALSE?,They cannot all be run by leaders who belong to the same political party the president does.,They are established by the legislative branch.,,high_school_government_and_politics,
"The term ""budget deficit"" refers to the",amount the government spends in excess of its revenues,amount of interest on the national debt,,high_school_government_and_politics,
"Which of the following lists the hydrides of group-14 elements in order of thermal stability, from lowest to highest?",PbH4 < SnH4 < GeH4 < SiH4 < CH4,PbH4 < SnH4 < CH4 < GeH4 < SiH4,,college_chemistry,
"Predict the number of lines in the EPR spectrum of a solution of 13C-labelled methyl radical (13CH3•), assuming the lines do not overlap.",4,24,,college_chemistry,
"3 Cl−(aq) + 4 CrO_4^2−(aq) + 23 H+(aq) → 3 HClO2(aq) + 4 Cr3+(aq) + 10 H2O(l). In the reaction shown above, Cl−(aq) behaves as",a reducing agent,an acid,,college_chemistry,
A 0.217 g sample of HgO (molar mass = 217 g) reacts with excess iodide ions according to the reaction shown above. Titration of the resulting solution requires how many mL of 0.10 M HCl to reach equivalence point?,20 mL,50 mL,,college_chemistry,
"When an arguer causes confusion during refutation because of real or feigned lack of an ability to engage in refutation, that arguer may have committed the fallacy of",ignorance of refutation,poor sportsmanship,,logical_fallacies,
Which of the following is true of a valid categorical syllogism?,The middle term must be used in at least one premise in a universal or unqualified sense,The major premise must affirm the consequent,,logical_fallacies,
Arguing that what is true of the parts must be true of the whole is the fallacy of...,Composition,Appeal to ignorance,,logical_fallacies,
The complex question fallacy consists of,"asking a question that includes either an unproven assumption or more than one question, thus making a straightforward yes or no answer meaningless.","drawing a conclusion before examining the evidence, and only considering evidence that supports that conclusion.",,logical_fallacies,
Which one of the following items is an example of nonmaterial culture?,Dove symbol,A dove (bird),,high_school_geography,
Which of the following statements is NOT accurate regarding the services provided by local governments in the United States?,One neighborhood's efforts to reduce pollution are always supported by neighboring communities.,Duplication of efforts occurs often.,,high_school_geography,
The practice of hiring a foreign third-party service provider to run an operation is called,offshoring.,outsourcing.,,high_school_geography,
"During the third stage of the demographic transition model, which of the following is true?",Birth rates decline and population growth rate is less rapid.,Birth rates increase and population growth rate increases.,,high_school_geography,
Which expression is equivalent to 5 x 9?,(5 x 5) + (5 x 4),(5 x 5) + (5 x 9),,elementary_mathematics,
A total of 30 players will play basketball at a park. There will be exactly 5 players on each team. Which statement correctly explains how to find the number of teams needed?,Divide 30 by 5 to find 6 teams.,Multiply 30 and 5 to find 150 teams.,,elementary_mathematics,
A store sells 107 different colors of paint. They have 25 cans of each color in storage. The number of cans of paint the store has in storage can be found using the expression below. 107 × 25. How many cans of paint does the store have in storage?,"2,675",749,,elementary_mathematics,
"Olivia used the rule ""Add 11"" to create the number pattern shown below. 10, 21, 32, 43, 54 Which statement about the number pattern is true?",The number pattern will never have two even numbers next to each other.,The next two numbers in the pattern will be an even number then an odd number.,,elementary_mathematics,
"Let A be the set of all ordered pairs of integers (m, n) such that 7m + 12n = 22. What is the greatest negative number in the set B = {m + n : (m, n) \in A}?",-4,-2,,college_mathematics,
"Let A be a real 2x2 matrix. Which of the following statements must be true?
I. All of the entries of A^2 are nonnegative.
II. The determinant of A^2 is nonnegative.
III. If A has two distinct eigenvalues, then A^2 has two distinct eigenvalues.",II only,I only,,college_mathematics,
"Suppose that f(1 + x) = f(x) for all real x. If f is a polynomial and f(5) = 11, then f(15/2)",11,0,,college_mathematics,
"A tank initially contains a salt solution of 3 grams of salt dissolved in 100 liters of water. A salt solution containing 0.02 grams of salt per liter of water is sprayed into the tank at a rate of 4 liters per minute. The sprayed solution is continually mixed with the salt solution in the tank, and the mixture flows out of the tank at a rate of 4 liters per minute. If the mixing is instantaneous, how many grams of salt are in the tank after 100 minutes have elapsed?",2 + e^-4,2,,college_mathematics,
Pascale is interested in the processing strategies children use to learn new information. Pascale would best be classified as what type of psychologist?,cognitive,behaviorist,,high_school_psychology,
"While swimming in the ocean, Ivan is frightened by a dark shadow in the water even before he has the chance to identify what the shadow is. The synaptic connections taking place during this incident of fright are best described by which of the following?",Messages are sent from the thalamus directly to the amygdala.,Messages are sent from the frontal lobes to the pituitary gland.,,high_school_psychology,
"According to the Individuals with Disabilities Education Improvement Act, which of the following must an educational agency do before it changes the educational placement of a student with a disability?",Notify the parents in writing,Obtain parental consent,,high_school_psychology,
"According to Caplan's model of consultee-centered case consultation, the consultant is primarily interested in",identifying and eliminating the causes of the consultee's difficulties in handling a problem,identifying the causes and solutions of the client's presenting problems,,high_school_psychology,
" Which of the given formulas of PL is the best symbolization of the following sentence?
Turtles live long lives and are happy creatures, unless they are injured.",(L • H) ∨ I,L • (H ⊃ R),,formal_logic,
" Select the best English interpretation of the given arguments in predicate logic.
Dm
(∀x)(Wx ⊃ ~Dx)
(∀x)Wx ∨ Ag	/ (∃x)Ax",Marina is a dancer. No weakling is a dancer. Either everything is a weakling or Georgia plays volleyball. So something plays volleyball.,Marina is a dancer. No weakling is a dancer. Everything is either a weakling or plays volleyball. So something plays volleyball.,,formal_logic,
" Construct a complete truth table for the following pairs of propositions. Then, using the truth tables, determine whether the statements are logically equivalent or contradictory. If neither, determine whether they are consistent or inconsistent. Justify your answers.
E ⊃ (F · E) and ~E · F","Neither logically equivalent nor contradictory, but consistent",Inconsistent,,formal_logic,
Select the best translation into predicate logic.George borrows Hector's lawnmower. (g: George; h: Hector; l: Hector's lawnmower; Bxyx: x borrows y from z),Bglh,Bghl,,formal_logic,
"Which of the following sets has the smallest standard deviation? Which has the largest?
I: {1,2,3}
II: {-10,10}
III: {100}
","III, II","II, III",,high_school_statistics,
"After a frost warning was issued, the owner of a large orange grove asked his workers to spray all his trees with water. The water was supposed to freeze and form a protective covering of ice around the orange blossom. Nevertheless, the owner suspected that some trees suffered considerable damage due to the frost. To estimate the proportion of trees that suffered more than 50 percent damage due to the frost, he took a random sample of 100 trees from his grove. What is the response variable in this experiment?","For each sampled tree, whether it suffered more than 50 percent damage or at most 50 percent damage.",The number of trees affected by the frost.,,high_school_statistics,
"A new smartwatch is manufactured in one part of a factory, then secured for shipping in another, independent part of the factory. The weight of the smartwatch has a mean of 62 grams and a standard deviation of 1.0 grams. The weight of the packaging (box, user's guide, bubble wrap, etc.) has a mean of 456 grams and a standard deviation of 6 grams. Together, the distribution of the weight of the smartwatch and its packaging would have the following mean and standard deviation:",Mean 518 grams; standard deviation 6.1 grams,Mean 518 grams; standard deviation 3.5 grams,,high_school_statistics,
"Suppose X and Y are random variables with E(X) = 37, var(X) = 5, E(Y) = 62, and var(Y) = 12. What are the expected value and variance of the random variable X + Y?",There is insufficient information to answer this question.,"E(X + Y) = 99, var(X + Y) = 17",,high_school_statistics,
How the consent to be bound of a State may be expressed?,"The consent of a state to be bound by a treaty may be expressed by signature, ratification, acceptance, approval or accession",The consent of a State to be bound is expressed only by ratification,,international_law,
Would a reservation to the definition of torture in the ICCPR be acceptable in contemporary practice?,This is an unacceptable reservation because it contravenes the object and purpose of the ICCPR,This is an acceptable reservation if the reserving country's legislation employs a different definition,,international_law,
When 'consent' can serve as a circumstance precluding the wrongfulness of a State conduct?,"Consent can serve as a circumstance precluding wrongfulness, provided the consent is valid and to the extent that the conduct remains within the limits of the consent given",Consent can never serve as a circumstance precluding wrongfulness,,international_law,
What is the judge ad hoc?,"If a party to a contentious case before the ICJ does not have a national sitting as judge, it is entitled to nominate someone as a judge solely for that case, with the title of judge ad hoc",Judge ad hoc is the judge that each party will always nominate in every contentious case,,international_law,
