question,correct,incorrect,MCQ_id,source,difficulty
"This question refers to the following information.
Albeit the king's Majesty justly and rightfully is and ought to be the supreme head of the Church of England, and so is recognized by the clergy of this realm in their convocations, yet nevertheless, for corroboration and confirmation thereof, and for increase of virtue in Christ's religion within this realm of England, and to repress and extirpate all errors, heresies, and other enormities and abuses heretofore used in the same, be it enacted, by authority of this present Parliament, that the king, our sovereign lord, his heirs and successors, kings of this realm, shall be taken, accepted, and reputed the only supreme head in earth of the Church of England, called Anglicans Ecclesia; and shall have and enjoy, annexed and united to the imperial crown of this realm, as well the title and style thereof, as all honors, dignities, preeminences, jurisdictions, privileges, authorities, immunities, profits, and commodities to the said dignity of the supreme head of the same Church belonging and appertaining; and that our said sovereign lord, his heirs and successors, kings of this realm, shall have full power and authority from time to time to visit, repress, redress, record, order, correct, restrain, and amend all such errors, heresies, abuses, offenses, contempts, and enormities, whatsoever they be, which by any manner of spiritual authority or jurisdiction ought or may lawfully be reformed, repressed, ordered, redressed, corrected, restrained, or amended, most to the pleasure of Almighty God, the increase of virtue in Christ's religion, and for the conservation of the peace, unity, and tranquility of this realm; any usage, foreign land, foreign authority, prescription, or any other thing or things to the contrary hereof notwithstanding.
English Parliament, Act of Supremacy, 1534
From the passage, one may infer that the English Parliament wished to argue that the Act of Supremacy would",end various forms of corruption plaguing the Church in England,establish Calvinism as the one true theology in England,,high_school_european_history,
"This question refers to the following information.
In Russia there was nothing going on well, and [Souvarine] was in despair over the news he had received. His old companions were all turning to the politicians; the famous Nihilists who made Europe tremble-sons of village priests, of the lower middle class, of tradesmen-could not rise above the idea of national liberation, and seemed to believe that the world would be delivered-when they had killed their despot&…
""Foolery! They'll never get out of it with their foolery.""
Then, lowering his voice still more, in a few bitter words he described his old dream of fraternity. He had renounced his rank and his fortune; he had gone among workmen, only in the hope of seeing at last the foundation of a new society of labour in common. All the sous in his pockets had long gone to the urchins of the settlement; he had been as tender as a brother with the colliers, smiling at their suspicion, winning them over by his quiet workmanlike ways and his dislike of chattering. But decidedly the fusion had not taken place.
His voice changed, his eyes grew bright, he fixed them on étienne, directly addressing him:
""Now, do you understand that? These hatworkers at Marseilles who have won the great lottery prize of a hundred thousand francs have gone off at once and invested it, declaring that they are going to live without doing anything! Yes, that is your idea, all of you French workmen; you want to unearth a treasure in order to devour it alone afterwards in some lazy, selfish corner. You may cry out as much as you like against the rich, you haven't got courage enough to give back to the poor the money that luck brings you. You will never be worthy of happiness as long as you own anything, and your hatred of the bourgeois proceeds solely from an angry desire to be bourgeois yourselves in their place.""
émile Zola, French writer, Germinal, 1885
The passage displays the direct concern for the welfare of the working classes that was typically a part of which movement?",Communist,Existentialist,,high_school_european_history,
"This question refers to the following information.
The excerpts below are from the Navigation Acts of 1651.
[A]fter the first day of December, one thousand six hundred fifty and one, and from thence forwards, no goods or commodities whatsoever of the growth, production or manufacture of Asia, Africa or America, or of any part thereof; or of any islands belonging to them, or which are described or laid down in the usual maps or cards of those places, as well of the English plantations as others, shall be imported or brought into this Commonwealth of England, or into Ireland, or any other lands, islands, plantations, or territories to this Commonwealth belonging, or in their possession, in any other ship or ships, vessel or vessels whatsoever, but only in such as do truly and without fraud belong only to the people of this Commonwealth, or the plantations thereof, as the proprietors or right owners thereof; and whereof the master and mariners are also of the people of this Commonwealth, under the penalty of the forfeiture and loss of all the goods that shall be imported contrary to this act, , , ,
[N]o goods or commodities of the growth, production, or manufacture of Europe, or of any part thereof, shall after the first day of December, one thousand six hundred fifty and one, be imported or brought into this Commonwealth of England, or any other lands or territories to this Commonwealth belonging, or in their possession, in any ship or ships, vessel or vessels whatsoever, but in such as do truly and without fraud belong only to the people of this Commonwealth, and in no other, except only such foreign ships and vessels as do truly and properly belong to the people of that country or place, of which the said goods are the growth, production or manufacture.
Which of the following best describes the outcome of the Navigation Acts of 1651?","They served as a catalyst for the growth of English shipping and overseas trade, but did little to limit the prospects of the Dutch in the seventeenth century.","They led to nearly a century of recurrent war between England and the Netherlands, which would not end until after American independence.",,high_school_european_history,
"This question refers to the following information.
Read the following excerpt.
The revolutionary seed had penetrated into every country and spread more or less. It was greatly developed under the régime of the military despotism of Bonaparte. His conquests displaced a number of laws, institutions, and customs; broke through bonds sacred among all nations, strong enough to resist time itself; which is more than can be said of certain benefits conferred by these innovators.
The monarchs will fulfil the duties imposed upon them by Him who, by entrusting them with power, has charged them to watch over the maintenance of justice, and the rights of all, to avoid the paths of error, and tread firmly in the way of truth. Placed beyond the passions which agitate society, it is in days of trial chiefly that they are called upon to despoil realities of their false appearances, and to show themselves as they are, fathers invested with the authority belonging by right to the heads of families, to prove that, in days of mourning, they know how to be just, wise, and therefore strong, and that they will not abandon the people whom they ought to govern to be the sport of factions, to error and its consequences, which must involve the loss of society.
Union between the monarchs is the basis of the policy which must now be followed to save society from total ruin. . . .
Let them not confound concessions made to parties with the good they ought to do for their people, in modifying, according to their recognized needs, such branches of the administration as require it.
Let them be just, but strong; beneficent, but strict.
Let them maintain religious principles in all their purity, and not allow the faith to be attacked and morality interpreted according to the social contract or the visions of foolish sectarians.
Let them suppress Secret Societies; that gangrene of society.
—Klemens von Metternich, Political Confession of Faith, 1820
Which of the following was the greatest cause of the fears expressed by Metternich in the document above?",The ideas of personal liberty and nationalism conceived during the Enlightenment resulted in radical revolutions that could spread throughout Europe.,The conquest of Europe by Napoleon led to the creation of new factions and shifted the European balance of power.,,high_school_european_history,
Glycolysis is the name given to the pathway involving the conversion of:,glycogen or glucose to pyruvate or lactate.,glycogen or glucose to fructose.,,clinical_knowledge,
In the assessment of the hand function which of the following is true?,Opposition of the thumb by opponens policis is supplied by spinal root T1,Finger adduction is supplied by the median nerve,,clinical_knowledge,
"How many attempts should you make to cannulate a patient before passing the job on to a senior colleague, according to the medical knowledge of 2020?",2,4,,clinical_knowledge,
What is the difference between a male and a female catheter?,Male catheters are longer than female catheters.,Male and female catheters are different colours.,,clinical_knowledge,
The stage of meiosis in which chromosomes pair and cross over is:,prophase I,metaphase II,,medical_genetics,
A gene showing codominance,has both alleles independently expressed in the heterozygote,has alleles tightly linked on the same chromosome,,medical_genetics,
Which of the following conditions does not show multifactorial inheritance?,Marfan syndrome,Pyloric stenosis,,medical_genetics,
DNA ligase is,an enzyme that joins fragments in normal DNA replication,an enzyme that facilitates transcription of specific genes,,medical_genetics,
"This question refers to the following information.
I come not to urge personal claims, nor to seek individual benefits; I appear as the advocate of those who cannot plead their own cause; I come as the friend of those who are deserted, oppressed, and desolate. In the Providence of God, I am the voice of the maniac whose piercing cries from the dreary dungeons of your jails penetrate not your Halls of Legislation. I am the Hope of the poor crazed beings who pine in the cells, and stalls, and cages, and waste rooms of your poor-houses. I am the Revelation of hundreds of wailing, suffering creatures, hidden in your private dwellings, and in pens and cabins—shut out, cut off from all healing influences, from all mind-restoring cares.… Could their melancholy histories be spread before you as revealed to my grieved spirit during the last three months, how promptly, how earnestly would you search out the most approved means of relief; how trifling, how insignificant, by comparison, would appear the sacrifices you are asked to make; how would a few dimes and dollars, gathered from each citizen, diminish in value as a possession, compared with the certain benefits and vast good to be secured for the suffering insane...by the consecration and application of a sufficient fund to the construction of a suitable hospital.…
—Dorothea Dix, Memorial Soliciting a State Hospital for the Protection and Cure of the Insane,
Submitted to the General Assembly of North Carolina, November 1848
Dorothea Dix can best be compared to whom?",Clara Barton,Abigail Adams,,high_school_us_history,
"This question refers to the following information.
""In the new Code of Laws which I suppose it will be necessary for you to make I desire you would Remember the Ladies, and be more generous and favorable to them than your ancestors. Do not put such unlimited power into the hands of the Husbands. Remember all Men would be tyrants if they could. If particular care and attention is not paid to the Ladies we are determined to foment a Rebellion, and will not hold ourselves bound by any Laws in which we have no voice, or Representation.""
Abigail Adams, in a letter to John Adams, 1776
""Special legislation for woman has placed us in a most anomalous position. Women invested with the rights of citizens in one section—voters, jurors, office-holders—crossing an imaginary line, are subjects in the next. In some States, a married woman may hold property and transact business in her own name; in others, her earnings belong to her husband. In some States, a woman may testify against her husband, sue and be sued in the courts; in others, she has no redress in case of damage to person, property, or character. In case of divorce on account of adultery in the husband, the innocent wife is held to possess no right to children or property, unless by special decree of the court. But in no State of the Union has the wife the right to her own person, or to any part of the joint earnings of the co-partnership during the life of her husband. In some States women may enter the law schools and practice in the courts; in others they are forbidden. In some universities girls enjoy equal educational advantages with boys, while many of the proudest institutions in the land deny them admittance, though the sons of China, Japan and Africa are welcomed there. But the privileges already granted in the several States are by no means secure.""
Susan B. Anthony, ""Declaration of Rights for Women,"" July 4, 1876
The sentiments expressed in the second excerpt by Susan B. Anthony are most likely in support of",universal suffrage,the Equal Rights Amendment,,high_school_us_history,
"This question refers to the following information.
Our leaders talk about stopping aggression from the north, but this was a struggle among groups of Vietnamese until we intervened. We seem bent upon saving the Vietnamese from Ho Chi Minh even if we have to kill them and demolish their country to do it. As the native people survey bombed-out villages, women and children burned by napalm, rice crops destroyed and cities overrun with our military personnel, they are doubtless saying secretly of the Vietcong guerillas and of the American forces, ""A plague on both your houses."" … Stop the bombing, north and south, end search and destroy offensive sweeps, and confine our military action to holding operations on the ground. Bombing the north has failed to halt or seriously check the flow of troops to the south and may, in fact, have prompted a much greater war effort by Hanoi.
—Senator George McGovern, ""The Lessons of Vietnam,"" April 25, 1967
Which of the following opinions from the 1960s most directly reflects the perspective of George McGovern's speech?",American bombing in Vietnam is a failure.,Americans must maximize their technological edge in Vietnam.,,high_school_us_history,
"This question refers to the following information.
""As our late Conduct at the Conestoga Manor and Lancaster have occasioned much Speculation & a great diversity of Sentiments in this and neighboring Governments; some vindicating & others condemning it; some charitably alleviating the Crime, & others maliciously painting it in the most odious & detestable Colours, we think it our duty to lay before the Publick, the whole Matter as it appeared, & still appears, to us. . . .
""If these things are not sufficient to prove an unjustifiable Attachment in the Quakers to the Indians Savages, a fixed Resolution to befriend them & an utter insensibility to human Distresses, let us consider a few more recent Facts. When we found the last Summer that we were likely to get no Assistance from the Government, some Volunteers went out at our own Expense, determined to drive our Enemies from our Borders; & when we came near to the great Island, we understood that a Number of their Warriors had gone out against our Frontiers. Upon this we returned and came up with them and fought with them at the Munfey Hill where we lost some of our Men & killed some of their Warriors & thereby saved our Frontiers from this Story in another Expedition. But no sooner had we destroyed their Provisions on the great Island, & ruined their trade with the good People at Bethlehem, but these very Indians, who were justly suspected of having murdered our Friends in Northampton County, were by the Influence of some Quakers taken under the Protection of the Government to screen them from the Resentments of the Friends and Relations of the Murdered, & to support them thro the Winter.""
—""Apology of the Paxton Boys"" (pamphlet), 1764 (Note: ""apology"" in this context should be read as an explanation, not an admission of guilt or regret.)
The sentiments expressed in the explanation above reflect which of the ongoing tensions during the colonial period of American history?",Tensions between backcountry settlers and elites within colonial America.,Tensions between British policies and the aspirations of North American colonists.,,high_school_us_history,
"A point charge, Q = +1 mC, is fixed at the origin. How much work is required to move a charge, Q = +8 µC, from the point (0, 4 meters) to the point (3 meters, 0)?",6.0 J,3.5 J,,high_school_physics,
"A photocell of work function ϕ = 2eV is connected to a resistor in series. Light of frequency f = 1 × 10^15 Hz hits a metal plate of the photocell. If the power of the light is P = 100 W, what is the current through the resistor?",24 A,6:00 AM,,high_school_physics,
"A microwave oven is connected to an outlet, 120 V, and draws a current of 2 amps. At what rate is energy being used by the microwave oven?",240 W,60 W,,high_school_physics,
"A pipe full of air is closed at one end. A standing wave is produced in the pipe, causing the pipe to sound a note. Which of the following is a correct statement about the wave’s properties at the closed end of the pipe?","The pressure is at an antinode, but the particle displacement is at a node.","The pressure is at a node, but the particle displacement is at an antinode.",,high_school_physics,
"This question refers to the following information.
""At least one of the [world's] societies would have to somehow enormously increase its productivity [in order to achieve global hegemony]. That quantum jump would have to be made before the various scientific, technological, agricultural, and industrial revolutions on which our post-quantum-leap world rests. It could only be accomplished by exploiting the ecosystems, mineral resources, and human assets of whole continents outside the lands of the society making the jump. Western Europe did just that by means of its brutality and guns and, more important, by geographical and ecological luck.""
Copyright © 2015 Cambridge University Press.
Alfred Crosby, historian, Ecological Imperialism, 2004
The ""quantum jump"" mentioned in the passage most directly contributed to which of the following developments in the period 1450–1750 C.E.?",An increase in the population of the world through more plentiful supplies of food,An increase in social unrest,,high_school_world_history,
"This question refers to the following information.
""The real grievance of the worker is the insecurity of his existence; he is not sure that he will always have work, he is not sure that he will always be healthy, and he foresees that he will one day be old and unfit to work. If he falls into poverty, even if only through a prolonged illness, he is then completely helpless, exam_ins to his own devices, and society does not currently recognize any real obligation towards him beyond the usual help for the poor, even if he has been working all the time ever so faithfully and diligently. The usual help for the poor, however, leaves a lot to be desired, especially in large cities, where it is very much worse than in the country.""
Otto von Bismarck, 1884
Otto von Bismarck likely made this speech in reaction to which of the following issues?",Negative effects attributed to industrial capitalism,Declining life expectancy in Germany,,high_school_world_history,
"This question refers to the following information.
""Indeed, as both the fatwas of distinguished [scholars] who base their opinion on reason and tradition alike and the consensus of the Sunni community agree that the ancient obligation of extirpation, extermination, and expulsion of evil innovation must be the aim of our exalted aspiration, for ""Religious zeal is a victory for the Faith of God the Beneficent""; then, in accordance with the words of the Prophet (Peace upon him!) ""Whosoever introduces evil innovation into our order must be expelled"" and ""Whosoever does aught against our order must be expelled,"" action has become necessary and exigent…""
Letter from Ottoman Sultan Selim I to Safavid Shah Ismail I, 1514
The letter from Selim I is most clearly an example of which of the following?",Expanding tensions between religious sects,Factors that brought about the collapse of the Ottoman Empire,,high_school_world_history,
"This question refers to the following information.
""The struggle against neo-colonialism is not aimed at excluding the capital of the developed world from operating in less developed countries. It is aimed at preventing the financial power of the developed countries being used in such a way as to impoverish the less developed.
Non-alignment, as practiced by Ghana and many other countries, is based on co-operation with all States whether they be capitalist, socialist or have a mixed economy. Such a policy, therefore, involves foreign investment from capitalist countries, but it must be invested in accordance with a national plan drawn up by the government of the non-aligned State with its own interests in mind. The issue is not what return the foreign investor receives on his investments…The question is one of power. A State in the grip of neo-colonialism is not master of its own destiny.""
Kwame Nkrumah, Neo-Colonialism, 1965
Which of the following provides the best context for Nkrumah's writings?",Decolonization,Regional Free Trade Associations,,high_school_world_history,
Which of the following is necessarily a characteristic of oligopoly?,A few large producers,Free entry into and exit from the market,,high_school_microeconomics,
The concentration ratio for a monopoly is,100,5,,high_school_microeconomics,
Which of the following is true of a price floor?,"To be an effective floor, it must be set above the equilibrium price.",The price floor shifts the demand curve to the left.,,high_school_microeconomics,
"If the government subsidizes producers in a perfectly competitive market, then",the consumer surplus will increase,the demand for the product will decrease,,high_school_microeconomics,
"Suppose now that a researcher wishes to use information criteria to determine the optimal lag length for a VAR. 500 observations are available for the bi-variate VAR, and the values of the determinant of the variance-covariance matrix of residuals are 0.0336, 0.0169, 0.0084, and 0.0062 for 1, 2, 3, and 4 lags respectively. What is the optimal model order according to Akaike's information criterion?",3 lags,4 lags,,econometrics,
"Suppose that a test statistic has associated with it a p-value of 0.08. Which one of the following statements is true?

(i) If the size of the test were exactly 8%, we would be indifferent between rejecting and not rejecting the null hypothesis

(ii) The null would be rejected if a 10% size of test were used

(iii) The null would not be rejected if a 1% size of test were used

(iv) The null would be rejected if a 5% size of test were used.","(i), (ii), and (iii) only",(i) and (iii) only,,econometrics,
What would be then consequences for the OLS estimator if heteroscedasticity is present in a regression model but ignored?,It will be inefficient,"All of (a), (b) and (c) will be true.",,econometrics,
"Consider the following AR(1) model with the disturbances having zero mean and unit variance

yt = 0.2 + 0.4 yt-1 + ut

The (unconditional) mean of y will be given by",0.33,0.5,,econometrics,
"Consider a computer design in which multiple processors, each with a private cache memory, share global memory using a single bus. This bus is the critical system resource. Each processor can execute one instruction every 500 nanoseconds as long as memory references are satisfied by its local cache. When a cache miss occurs, the processor is delayed for an additional 2,000 nanoseconds. During half of this additional delay, the bus is dedicated to serving the cache miss. During the other half, the processor cannot continue, but the bus is free to service requests from other processors. On average, each instruction requires 2 memory references. On average, cache misses occur on 1 percent of references. What proportion of the capacity of the bus would a single processor consume, ignoring delays due to competition from other processors?",1/27,1/50,,college_computer_science,
"The Singleton design pattern is used to guarantee that only a single instance of a class may be instantiated. Which of the following is (are) true of this design pattern?
I. The Singleton class has a static factory method to provide its instance.
II. The Singleton class can be a subclass of another class.
III. The Singleton class has a private constructor.","I, II, and III",II only,,college_computer_science,
"A compiler generates code for the following assignment statement.
G := (A + B) * C - (D + E) * F
The target machine has a single accumulator and a single-address instruction set consisting of instructions load, store, add, subtract, and multiply. For the arithmetic operations, the left operand is taken from the accumulator and the result appears in the accumulator. The smallest possible number of instructions in the resulting code is",9,6,,college_computer_science,
